created_at,text,tidy_tweet,Abstract,
9/23/2019 16:04,b'@SamsungMobile using your Device I purchased services of an app via Play store. Payment made but subscription not s\xe2\x80\xa6 https://t.co/07ZTZxYw1m',using your Device purchased services Play store Payment made subscription,CustomerService,
9/23/2019 15:46,"b'IPhone 7 plus screen replacement this morning, #freytechnology #chambersburg #chambersburgpa #repair #repairshop\xe2\x80\xa6 https://t.co/RjTIvb1ZKI'",IPhone plus screen replacement this morning #freytechnology #chambersburg #chambersburgpa #repair #repairshop,CustomerService,
9/23/2019 15:32,"b""Samsung's 10.5-inch Galaxy Tab A is on sale for $100 off on Amazon https://t.co/897ivnbEUv #MashableShopping #GalaxyTab #Samsung #Tablets""",Samsung inch Galaxy sale Amazon,Price,
9/23/2019 15:29,"b""The reason I don't recommend the #Samsung #GalaxyFold is that it is still extremely fragile. Better to wait until t\xe2\x80\xa6 https://t.co/ZTusRIEiQA""",reason recommend #Samsung #GalaxyFold that still extremely fragile Better wait until,Recommendation,
9/23/2019 15:24,b'Samsung Galaxy S8+ plus Cracked Screen Glass Repair Replacement Mail In Service   ( 981 Watch Count )   #Samsung\xe2\x80\xa6 https://t.co/ebhsiL5pAi',Samsung Galaxy plus Cracked Screen Glass Repair Replacement Mail Service Watch Count #Samsung,CustomerService,
9/23/2019 15:24,b'The Galaxy Fold goes on sale again in the US on September 27th \nhttps://t.co/qqh4xnsILI  #Samsung #Fold #Galaxy\xe2\x80\xa6 https://t.co/rD6mX7GmcJ',Galaxy Fold goes sale again September nhttps xnsILI #Samsung #Fold #Galaxy,Price,
9/23/2019 15:09,"b'\xe2\x80\x9csupremely easy to scratch, and the phone is not water or dust resistant\xe2\x80\x9d &gt;&gt; \n\nSamsung\xe2\x80\x99s Galaxy Fold goes on sale F\xe2\x80\xa6 https://t.co/4FteskjA5U'",csupremely easy scratch phone water dust resistant nSamsung Galaxy Fold goes sale,Price,
9/23/2019 15:06,"b'See our latest #CostaMesa, CA job and click to apply: Retail Sales-Samsung Electronics - https://t.co/X6hKwiHsv9 #Samsung'",latest #CostaMesa click apply Retail Sales Samsung Electronics,Price,
9/23/2019 14:56,b'Samsung Qled 4K TV\nExplore the latest #TV technologies and features available in the new #Samsung #QLED #4K Smart T\xe2\x80\xa6 https://t.co/nsxpaQFBGs',Samsung Qled nExplore latest technologies features available #Samsung #QLED Smart,Products,
9/23/2019 14:56,"b'#Samsung\xe2\x80\x99s #GalaxyFold goes on sale #Friday,September27 in the #US   @thenextweb https://t.co/H0d2X4gl6A'",#Samsung #GalaxyFold goes sale #Friday September,Price,
9/23/2019 14:54,b'\xf0\x9f\x99\x82\xf0\x9f\x99\x82\xf0\x9f\x99\x82Samsung Galaxy Note10 Plus Full Specification &amp; Price.\n\nCheck Out: https://t.co/XrQyeiGKJT\n\n#samsungnote10plus\xe2\x80\xa6 https://t.co/pbNWvWAhDT',Samsung Galaxy Note Plus Full Specification Price nCheck,Price,
9/23/2019 14:52,"b""We're hiring! Click to apply: Retail Sales-Samsung Electronics - https://t.co/kLUny5fIcq #Samsung #Aiea, HI""",hiring Click apply Retail Sales Samsung Electronics,Price,
9/23/2019 14:45,b'The sale of #Galaxy_Fold device again in the United States on September 27\nhttps://t.co/O8XeSPDxl1\n#SAMSUNG https://t.co/fIE2dE8UgI',sale #Galaxy Fold device again United States September nhttps XeSPDxl n#SAMSUNG,Price,
9/23/2019 14:44,b'Samsung Announces New Mid-Range Phone Galaxy A20s: Here Are The Features\n\nhttps://t.co/c1DQxFrkPN\n\n#Samsung #android',Samsung Announces Range Phone Galaxy Here Features nhttps DQxFrkPN n#Samsung #android,Products,
9/23/2019 14:39,"b'See our latest #Edwardsville, IL job and click to apply: Retail Sales-Samsung Electronics - https://t.co/3QNeEUJmGt #Samsung'",latest #Edwardsville click apply Retail Sales Samsung Electronics,Price,
9/23/2019 14:36,b'My husband is #streaming #live a #phone #repair. it\xe2\x80\x99s the galaxy S9 screen replacement. Join us! Say hi!\xe2\x80\xa6 https://t.co/eIzHTcCp18',husband #streaming #live #phone #repair galaxy screen replacement Join,CustomerService,
9/23/2019 14:25,"b'Samsung Nepal released Galaxy A10s 2/32GB variant for the price of Rs. 16,790.\nBut is this the best Samsung has to\xe2\x80\xa6 https://t.co/moLZMFv2mL'",Samsung Nepal released Galaxy variant price nBut this best Samsung,Price,
9/23/2019 14:24,"b'iPhone lcd screen repair on site within 15 min ,Same day service ,Guaranteed !!#wefixit #iphone #ipod #ipad\xe2\x80\xa6 https://t.co/cXGrs3Ow1C'",iPhone screen repair site within Same service Guaranteed #wefixit #iphone #ipod #ipad,CustomerService,
9/23/2019 14:20,b'Future Proof FutureProofN Follow us for the latest news #samsung Samsung will start selling the Galaxy Fold in the\xe2\x80\xa6 https://t.co/jf6RbfYTOx',Future Proof FutureProofN Follow latest news #samsung Samsung will start selling Galaxy Fold,News,
9/23/2019 14:15,"b'#samsung\xe2\x80\x99s $2,000 folding phone will launch in the US on Sept. 27 after months of\xc2\xa0delays https://t.co/NC9kodYNf8 https://t.co/R8AUf3Sx2d'",#samsung folding phone will launch Sept after months delays,News,
9/23/2019 13:51,b'Voice Search Direct on sale this week: https://t.co/Psl3K83uKB  Assign this little app to start voice search (Googl\xe2\x80\xa6 https://t.co/TiIZqjwZwJ',Voice Search Direct sale this week,Price,
9/23/2019 13:47,"b'According to Korean media reports, Samsung will launch the Galaxy S11 in the 1st half of next year.The big change i\xe2\x80\xa6 https://t.co/EYRQEK8XWJ'",According Korean media reports Samsung will launch Galaxy half next year change,News,
9/23/2019 13:47,b'Samsung Galaxy M series get price cut during Amazon\xe2\x80\x99s Great Indian Festival #Samsung #Amazon #GreatIndianFestive\xe2\x80\xa6 https://t.co/d78RebuphN',Samsung Galaxy series price during Amazon Great Indian Festival #Samsung #Amazon #GreatIndianFestive,Price,
9/23/2019 13:47,"b'Unbeatable offer from @buylappie .\n\nSamsung Galaxy S6edge\n32gb, N47,000\n64gb, N54,000\n\nDm/WhatsApp:08099728491\xe2\x80\xa6 https://t.co/E9RwvXijC8'",Unbeatable offer from nSamsung Galaxy edge WhatsApp,Price,
9/23/2019 13:37,b'#electronics #smart #anime #tech #phone #fitness #hiking #camp #manga #iron #man #news #sports #charger #iphone\xe2\x80\xa6 https://t.co/Ce3ISuo9Ss',#electronics #smart #anime #tech #phone #fitness #hiking #camp #manga #iron #man #news #sports #charger #iphone,News,
9/23/2019 13:36,"b'@Apple hello ji, will u stop giving ad for every youtube video i openin! I dont even eat apple , bcoz its costly, h\xe2\x80\xa6 https://t.co/9cnxQvpNhe'",hello will stop giving every youtube video openin dont even apple bcoz costly,Price,
9/23/2019 13:15,"b'#SAMSUNG India refuses to change my Faulty Product (Wall Mount)\nI ordered 40"" TV but received Wall mount of 32"" TV\xe2\x80\xa6 https://t.co/jWGcx3ltm1'",#SAMSUNG India refuses change Faulty Product Wall Mount ordered received Wall mount,CustomerService,
9/23/2019 13:15,"b'Samsung Galaxy A20s With Triple Rear Cameras, 4,000mAh Battery Launched https://t.co/DsB2sfMzFS\nvia @Gadgets360\xe2\x80\xa6 https://t.co/C0Dd4h8n34'",Samsung Galaxy With Triple Rear Cameras Battery Launched,News,
9/23/2019 13:05,b'#SAMSUNG refuses to replace its Faulty Product (Wall Mount). For a TV of 40 inch Samsung Sent Wall mount of 32 Inch\xe2\x80\xa6 https://t.co/ZBkSfSGpHr',#SAMSUNG refuses replace Faulty Product Wall Mount inch Samsung Sent Wall mount Inch,CustomerService,
9/23/2019 13:02,b'#Samsung Videos: Samsung Galaxy: How to protect your login information with Samsung Pass https://t.co/Js4w81pQ32',#Samsung Videos Samsung Galaxy protect your login information with Samsung Pass,News,
9/23/2019 12:51,"b'We\xe2\x80\x99ve got a great selection and even better prices. \n\nOur team professionally inspects, repairs and certifies all o\xe2\x80\xa6 https://t.co/3gGNW2MjE8'",great selection even better prices nOur team professionally inspects repairs certifies,Price,
9/23/2019 12:51,"b'The Monster is finally unleashed!\n\nThe all-new Galaxy M30s is loaded with features like 48MP triple camera setup, P\xe2\x80\xa6 https://t.co/v4AabzWIqu'",Monster finally unleashed nThe Galaxy loaded with features like triple camera setup,Products,
9/23/2019 12:45,"b'Samsung #GalaxyA20s Launched in Malaysia priced about RM 699 (~\xe2\x82\xb912,000)\n\n\xe2\x80\xa26.4"" HD+ TFT Infinity-V display\n\xe2\x80\xa2Snapdrag\xe2\x80\xa6 https://t.co/UFajqBgweT'",Samsung #GalaxyA Launched Malaysia priced about Infinity display Snapdrag,Price,
9/23/2019 12:38,b'#samsung #a70 for #sale almost new . 19.9k php #Philippines https://t.co/atwufdNqVZ',#samsung #sale almost #Philippines,Price,
9/23/2019 12:32,b'MicroBT Expects $400 Million in Q3 as Bitcoin Miner Sales Surge #mining #news #businessnews #china #samsung\xe2\x80\xa6 https://t.co/e3JDKISw4e',MicroBT Expects Million Bitcoin Miner Sales Surge #mining #news #businessnews #china #samsung,Price,
9/23/2019 12:18,"b'Samsung Galaxy A20s With 6.4-inch HD+ display, Triple rear cameras, 4000mAh Battery Launched #SamsungGalaxyA20s\xe2\x80\xa6 https://t.co/b133AEHTAr'",Samsung Galaxy With inch display Triple rear cameras Battery Launched #SamsungGalaxyA,News,
9/23/2019 12:16,b'Epris Wishes You A Happy Daughters Day... #repair #samsung #service #laptoprepair #tablet #mobilerepair #apple\xe2\x80\xa6 https://t.co/mHfAOcjUgO',Epris Wishes Happy Daughters #repair #samsung #service #laptoprepair #tablet #mobilerepair #apple,CustomerService,
9/23/2019 11:26,b'Samsung Galaxy S8+ plus Cracked Screen Glass Repair Replacement Mail In Service   ( 981 Watch count)   #Samsung\xe2\x80\xa6 https://t.co/clgOHOcp1d',Samsung Galaxy plus Cracked Screen Glass Repair Replacement Mail Service Watch count #Samsung,CustomerService,
9/23/2019 11:20,"b""I had to share this helpful information with the world because that's just how I roll. And technical issues scare m\xe2\x80\xa6 https://t.co/2wFi8tbtVS""",share this helpful information with world because that just roll technical issues scare,News,
9/23/2019 11:00,"b'\xf0\x9f\xa4\x96Galaxy A7 2017 Case Robot Armor (Black)\xf0\x9f\xa4\x96\xe2\xa0\x80\n\n\xe2\x9e\xa1\xef\xb8\x8fSlim, dual layer structure features a TPU body and polycarbonate shoc\xe2\x80\xa6 https://t.co/jALvAqlHqZ'",Galaxy Case Robot Armor Black fSlim dual layer structure features body polycarbonate shoc,Products,
9/23/2019 10:59,b'Samsung launches #GalaxyA20s.\n\n#Samsung https://t.co/lu5GAhkeaN',Samsung launches #GalaxyA n#Samsung,News,
9/23/2019 10:58,b'#MicroBT Expects $400 Million in Q3 as #Bitcoin Miner Sales Surge from CoinDesk - #BitcoinMiners #BusinessNews\xe2\x80\xa6 https://t.co/Nsu0p2xlTP',#MicroBT Expects Million #Bitcoin Miner Sales Surge from CoinDesk #BitcoinMiners #BusinessNews,Price,
9/23/2019 10:52,b'I always love this font from @pinkstarsxfonts  \n\nIcon :kraken\nWall: pinterest\n\n#novalauncher\n#samsung https://t.co/eI9l9qAIOy',always love this font from nIcon kraken nWall pinterest n#novalauncher n#samsung,News,
9/23/2019 10:45,b'#Samsung launches the #GalaxyA20s with triple rear cameras and a 4000 mAh battery https://t.co/I2Z1O2Vejt',#Samsung launches #GalaxyA with triple rear cameras battery,News,
9/23/2019 10:32,b'MicroBT Expects $400 Million Q3 Revenue From Bitcoin Miner Sales Despite Chip Holdup https://t.co/8vRvwqb97m #China\xe2\x80\xa6 https://t.co/ioAmttwG6P',MicroBT Expects Million Revenue From Bitcoin Miner Sales Despite Chip Holdup,Price,
9/23/2019 10:31,b'Most Selling Mobile Phones as of 2019.\n#SAMSUNG \n#Apple \n#Huawei \n#MakeInIndia \n#BusinessNews \n#IndianEconomy\xe2\x80\xa6 https://t.co/dxYoV1t4rz',Most Selling Mobile Phones n#SAMSUNG n#Apple n#Huawei n#MakeInIndia n#BusinessNews n#IndianEconomy,News,
9/23/2019 10:24,b'MicroBT Expects $400 Million Q3 Revenue From Bitcoin Miner Sales Despite Chip Holdup https://t.co/4zCte6n5n6\xe2\x80\xa6 https://t.co/3wUaWqorFw',MicroBT Expects Million Revenue From Bitcoin Miner Sales Despite Chip Holdup,Price,
9/23/2019 10:20,b'MicroBT Expects $400 Million Q3 Revenue From Miner Sales Despite Chip Holdup: The maker of WhatsMiner bitcoin miner\xe2\x80\xa6 https://t.co/ReifITzvcE',MicroBT Expects Million Revenue From Miner Sales Despite Chip Holdup maker WhatsMiner bitcoin miner,Price,
9/23/2019 10:16,b'MicroBT Expects $400 Million Q3 Revenue From #bitcoin Miner Sales Despite Chip Holdup - CoinDesk #China #Mining\xe2\x80\xa6 https://t.co/JbcTl76CW6',MicroBT Expects Million Revenue From #bitcoin Miner Sales Despite Chip Holdup CoinDesk #China #Mining,Price,
9/23/2019 10:16,b'MicroBT Expects $400 Million Q3 Revenue From Miner Sales Despite Chip Holdup\n\nRead here: https://t.co/AkB0NqnfnY\xe2\x80\xa6 https://t.co/3vCa4afx50',MicroBT Expects Million Revenue From Miner Sales Despite Chip Holdup nRead here,Price,
9/23/2019 10:00,b'#Microsoft salesman gave me a clever reason to dump my #iPhone https://t.co/XPs6ytUKAe #Samsung #Android #hardware #tech #app #smartphone',#Microsoft salesman gave clever reason dump #iPhone,Price,
9/23/2019 9:20,"b""Airlink's Presence Around Pakistan.\nOUR CUSTOMER OUR REALITY\n#airlink #samsung #huawei #pakistan https://t.co/8mo3Kqh53I""",Airlink Presence Around Pakistan nOUR CUSTOMER REALITY n#airlink #samsung #huawei #pakistan,CustomerService,
9/23/2019 9:20,"b""The Galaxy A10 is a highly capable smartphone at an affordable price. If you want to experience the Samsung's OneUI\xe2\x80\xa6 https://t.co/sJS5PHx6ZM""",Galaxy highly capable smartphone affordable price want experience Samsung OneUI,Price,
9/23/2019 9:12,b'SAMSUNG S6 Edge plus #SAMSUNG #smartphone #android #flagship #disassembly #hepekinfo #mobile #repair #tutorial\xe2\x80\xa6 https://t.co/nywRKB7D60',SAMSUNG Edge plus #SAMSUNG #smartphone #android #flagship #disassembly #hepekinfo #mobile #repair #tutorial,CustomerService,
9/23/2019 9:01,b'#Samsung #S8 edge is launched! Apply the #Theme for Samsung S8 #edge theme to enjoy more FREE #Wallpapers and Theme\xe2\x80\xa6 https://t.co/j7r1n3CVz2',#Samsung edge launched Apply #Theme Samsung #edge theme enjoy more FREE #Wallpapers Theme,News,
9/23/2019 9:00,b'#SAMSUNG #GalaxyFold sold out on the first day of launch in #Singapore https://t.co/QMl4VNpLPS https://t.co/3MWbc624WC',#SAMSUNG #GalaxyFold sold first launch #Singapore,News,
9/23/2019 8:42,b'in other news...spanky new @SamsungMobile note 10 is undamaged after my tumble...turned out the only thing that got\xe2\x80\xa6 https://t.co/L4UAOTsilt',other news spanky note undamaged after tumble turned only thing that,News,
9/23/2019 8:42,"b""The Samsung Galaxy A Series is most definitely the best received in the market thanks to it's explosive features. G\xe2\x80\xa6 https://t.co/bJY2NUFJYc""",Samsung Galaxy Series most definitely best received market thanks explosive features,Products,
9/23/2019 8:41,b'Apple\xe2\x80\x99s iOS 13 update for iPhone brought forward to fix bugs\n#News #Technology #Pro #IPhones #Italian #XR #AP\xe2\x80\xa6 https://t.co/9YxUWqvi71',Apple update iPhone brought forward bugs n#News #Technology #Pro #IPhones #Italian,News,
9/23/2019 7:57,b'Samsung launches Festive Scheme\nhttps://t.co/uiVTL8u9je\n#Samsung #Festive #Scheme #SamsungAayoKhusiChhayo\xe2\x80\xa6 https://t.co/4mxyNbnO4B',Samsung launches Festive Scheme nhttps uiVTL n#Samsung #Festive #Scheme #SamsungAayoKhusiChhayo,News,
9/23/2019 7:53,b'Breaking: Galaxy Fold review unit phones (literally). #technologynews #samsung https://t.co/f6GJeAz4Cu https://t.co/s6AeFyjYDD',Breaking Galaxy Fold review unit phones literally #technologynews #samsung,News,
9/23/2019 7:42,b'Samsung Galaxy S8+ plus Cracked Screen Glass Repair Replacement Mail In Service   ( 981 Watch Count )   #Samsung\xe2\x80\xa6 https://t.co/2hjVNV5t9y',Samsung Galaxy plus Cracked Screen Glass Repair Replacement Mail Service Watch Count #Samsung,CustomerService,
9/23/2019 7:12,b'#Samsung #SamsungGalaxyM30  #SamsungMobiles #MobilePhones #Smartphones #SamsungGalaxySeries #PriceComparison\xe2\x80\xa6 https://t.co/J8dXKnsbvS',#Samsung #SamsungGalaxyM #SamsungMobiles #MobilePhones #Smartphones #SamsungGalaxySeries #PriceComparison,Price,
9/23/2019 6:58,"b'*Samsung 1.5 Ton 3 Star (2017) Split AC (AR18MC3ULGM, White)*\n~MRP - 36200~\nPRICE - 28999\n\nOFFER LINK -\xe2\x80\xa6 https://t.co/FTNV9ZkwhE'",Samsung Star Split ULGM White nPRICE nOFFER LINK,Price,
9/23/2019 6:58,b'Another #Happy Customer unlocked a #Samsung #SC06D at #SRS Server..',Another #Happy Customer unlocked #Samsung #SRS Server,CustomerService,
9/23/2019 6:34,b'*Samsung 80 cm (32 Inches) Series 4 HD Ready LED TV UA32N4010AR (Black) (2018 model)*\n~MRP - 25900~\nPRICE - 13999\xe2\x80\xa6 https://t.co/JPF8qJdKMd',Samsung Inches Series Ready Black model nPRICE,Price,
9/23/2019 6:18,b'Samsung Galaxy M30s has been officially launched in India on 18TH September 2019. It comes with a 48MP triple camer\xe2\x80\xa6 https://t.co/24l2c8PgS8',Samsung Galaxy been officially launched India September comes with triple camer,News,
9/23/2019 5:42,b'Samsung Galaxy S8+ plus Cracked Screen Glass Repair Replacement Mail In Service   ( 981 Watch count)   #Samsung\xe2\x80\xa6 https://t.co/6YfNiG6wz3',Samsung Galaxy plus Cracked Screen Glass Repair Replacement Mail Service Watch count #Samsung,CustomerService,
9/23/2019 5:26,"b'Enjoy best in class electronics service with F2HELP. The services include installation, maintenance &amp; repair servic\xe2\x80\xa6 https://t.co/5Q78fxyKU7'",Enjoy best class electronics service with HELP services include installation maintenance repair servic,CustomerService,
9/23/2019 5:24,b'Samsung Galaxy S7 G930 Cracked Screen Glass Repair Replacement Mail In Service   ( 548 Watch Count )   #Samsung\xe2\x80\xa6 https://t.co/ZW6yCCbNEp',Samsung Galaxy Cracked Screen Glass Repair Replacement Mail Service Watch Count #Samsung,CustomerService,
9/23/2019 5:21,b'ELENXS Hot Sale Practical Mini F1 PP Plastic #Phone Tablet Bracket Holder for iPhone for #Samsung\n\xe2\x9e\xa1\xef\xb8\x8f\xe2\x80\xa6 https://t.co/GL28hVu9TG',ELENXS Sale Practical Mini Plastic #Phone Tablet Bracket Holder iPhone #Samsung,Price,
9/23/2019 5:20,b'*Samsung 125 cm (50 Inches) Super 6 Series 4K UHD LED Smart TV UA50NU6100 (Black) (2019 model)*\n~MRP - 94900~\nPRICE\xe2\x80\xa6 https://t.co/FlLpfcF0kX',Samsung Inches Super Series Smart Black model nPRICE,Price,
9/23/2019 5:06,b'Samsung asks users to be extra careful with the Galaxy Fold \nhttps://t.co/slr75JPAyT  #Samsung #Fold #Service #tech https://t.co/vcgSd8bbVt',Samsung asks users extra careful with Galaxy Fold nhttps JPAyT #Samsung #Fold #Service #tech,CustomerService,
9/23/2019 4:54,b'Samsung Galaxy S8 Cracked Screen Glass Repair Replacement Mail In Service   ( 666 Watch count)   #Samsung  #Galaxy  https://t.co/F1lDppaE3G',Samsung Galaxy Cracked Screen Glass Repair Replacement Mail Service Watch count #Samsung #Galaxy,CustomerService,
9/23/2019 4:52,b'Samsung Galaxy Note 10 and iPhone 11pro maybe just the most powerful and feature-packed devices in the market curre\xe2\x80\xa6 https://t.co/z77cDnookD',Samsung Galaxy Note iPhone maybe just most powerful feature packed devices market curre,Products,
9/23/2019 4:42,"b'Are you looking for the best #price #savings on the #latest #TV? This #SAMSUNG 82"" Ultra #HD (2160p) #HDR #Smart\xe2\x80\xa6 https://t.co/zRyrRnRKXQ'",looking best #price #savings #latest This #SAMSUNG Ultra #HDR #Smart,Price,
9/23/2019 4:34,b'New phone models will force app developers to rethink their current designs to fit changing specs and features. Cha\xe2\x80\xa6 https://t.co/7pVgB0rrlI',phone models will force developers rethink their current designs changing specs features,Products,
9/23/2019 4:22,b'#JustSmile #beauty #Nyc #GOT #TikTok #Pink \n\n 3in1 Explorer Car Charger with cable\n\nMore info ;\xe2\x80\xa6 https://t.co/SamCvFpIpJ',#JustSmile #beauty #Nyc #GOT #TikTok #Pink Explorer Charger with cable nMore info,News,
9/23/2019 3:50,b'Samsung A70s looks like new gradient back .\n\nthis will give lighting effect just like recently launched\xe2\x80\xa6 https://t.co/GXZpMrYfiy',Samsung looks like gradient back nthis will give lighting effect just like recently launched,News,
9/23/2019 3:49,"b'Samsung Galaxy Note 10 Plus, Galaxy Note10 With Free Galaxy Buds and More Offers Announced #SamsungGalaxyNote10Plus\xe2\x80\xa6 https://t.co/ytnAhRUxxk'",Samsung Galaxy Note Plus Galaxy Note With Free Galaxy Buds More Offers Announced #SamsungGalaxyNote Plus,Price,
9/23/2019 3:41,b'Samsung Galaxy S8 Cracked Screen Glass Repair Replacement Mail In Service   ( 666 Watch count)   #Samsung  #Galaxy  https://t.co/aKg9et2PTU',Samsung Galaxy Cracked Screen Glass Repair Replacement Mail Service Watch count #Samsung #Galaxy,CustomerService,
9/23/2019 3:27,"b'#SamsungGalaxyA70s #Samsung #SamsungGalaxy\nSamsung Galaxy A70s spotted in Tenaa , may launch soon(Feel free to retw\xe2\x80\xa6 https://t.co/RzR15L4n5M'",#SamsungGalaxyA #Samsung #SamsungGalaxy nSamsung Galaxy spotted Tenaa launch soon Feel free retw,News,
9/23/2019 3:21,b'#JustSmile #cosmetics #GOT #Nyc #TikTok \n\n NEW Bluetooth Earbuds 5.0 TWS Wireless Headsets for All Phone\n\nMore info\xe2\x80\xa6 https://t.co/3YXDk7QS5u',#JustSmile #cosmetics #GOT #Nyc #TikTok Bluetooth Earbuds Wireless Headsets Phone nMore info,News,
9/23/2019 3:18,b'Samsung Galaxy S7 G930 Cracked Screen Glass Repair Replacement Mail In Service   ( 548 Watch Count )   #Samsung\xe2\x80\xa6 https://t.co/57VUDdcl8x',Samsung Galaxy Cracked Screen Glass Repair Replacement Mail Service Watch Count #Samsung,CustomerService,
9/23/2019 3:08,b'The monster in market!!!\nSamsung Galaxy M30s\nWith 600 mAh Monster battery\nSale on 29th September.\nOnly on\xe2\x80\xa6 https://t.co/rOTGbtIizL',monster market nSamsung Galaxy nWith Monster battery nSale September nOnly,Price,
9/23/2019 2:48,b'Samsung has to work on the price if they want to compete with others. Samsung has huge Base if they price their pro\xe2\x80\xa6 https://t.co/OZFGlV30oa',Samsung work price they want compete with others Samsung huge Base they price their,Price,
9/23/2019 2:36,b'Samsung Galaxy S8+ plus Cracked Screen Glass Repair Replacement Mail In Service   ( 981 Watch Count )   #Samsung\xe2\x80\xa6 https://t.co/Q7rkHplWHF',Samsung Galaxy plus Cracked Screen Glass Repair Replacement Mail Service Watch Count #Samsung,CustomerService,
9/23/2019 1:07,"b'Type the word "" President "" into your phone... what options does it give you? \nMy #Samsung offered Bush Obama &amp; Clinton  \n\nYou?'",Type word President into your phone what options does give #Samsung offered Bush Obama Clinton nYou,Price,
9/23/2019 0:38,b'Top Six Reasons To Upgrade From A Note 8 To Note 10 Plus #Note8 #note10 #note10plus #Samsung https://t.co/ahemXwVN9l via @YouTube',Reasons Upgrade From Note Note Plus #Note #note #note plus #Samsung,Products,
9/23/2019 0:37,b'Top Six Reasons To Upgrade From A Note 8 To Note 10 Plus #Note8 #note10 #note10plus #Samsung https://t.co/GjKIeltA0O via @YouTube',Reasons Upgrade From Note Note Plus #Note #note #note plus #Samsung,Products,
9/23/2019 0:37,b'Top Six Reasons To Upgrade From A Note 8 To Note 10 Plus #Note8 #note10 #note10plus #Samsung https://t.co/37tOf1u4oH via @YouTube',Reasons Upgrade From Note Note Plus #Note #note #note plus #Samsung,Products,
9/23/2019 0:37,b'Top Six Reasons To Upgrade From A Note 8 To Note 10 Plus #Note8 #note10 #note10plus #Samsung https://t.co/ljQEymzeSb via @YouTube',Reasons Upgrade From Note Note Plus #Note #note #note plus #Samsung,Products,
9/23/2019 0:36,b'Top Six Reasons To Upgrade From A Note 8 To Note 10 Plus #Note8 #note10 #note10plus #Samsung https://t.co/7ueJxQRP7g via @YouTube',Reasons Upgrade From Note Note Plus #Note #note #note plus #Samsung,Products,
9/23/2019 0:35,b'Top Six Reasons To Upgrade From A Note 8 To Note 10 Plus #Note 8 #note10 #note10plus #Samsung https://t.co/rmwfEwivjj via @YouTube',Reasons Upgrade From Note Note Plus #Note #note #note plus #Samsung,Products,
9/22/2019 23:53,"b'The cheapest #samsung Galaxy Buds prices, #deals and sales in April 2019. #technology https://t.co/12NubT3Hzr https://t.co/QJbpTMFGol'",cheapest #samsung Galaxy Buds prices #deals sales April #technology,Price,
9/22/2019 23:02,"b""This is why I haven't changed my device in few years. I don't need a better camera... with features you need to be\xe2\x80\xa6 https://t.co/VsYinnvz6E""",This haven changed device years need better camera with features need,Products,
9/22/2019 20:17,b'Get the New Galaxy S10!\n#GalaxyS10\n#Offer \n#get\n#now\n#SAMSUNG https://t.co/pqQq07Yrex',Galaxy n#GalaxyS n#Offer n#get n#now n#SAMSUNG,Price,
9/22/2019 19:34,b'Visit Now.... #phonerepairs #Waterdamage Yes we fix them. We Repair #motherboard repairs #apple #iphone #Samsung\xe2\x80\xa6 https://t.co/7qewFOPsI4',Visit #phonerepairs #Waterdamage them Repair #motherboard repairs #apple #iphone #Samsung,CustomerService,
9/22/2019 18:18,"b'Wow. Apple did it again. Turned an iterative upgrade year into a \xe2\x80\x9cmust have\xe2\x80\x9d: awesome camera, incredible battery an\xe2\x80\xa6 https://t.co/VBb7E9raou'",Apple again Turned iterative upgrade year into cmust have awesome camera incredible battery,Products,
9/22/2019 18:06,b'Samsung Galaxy S8+ plus Cracked Screen Glass Repair Replacement Mail In Service   ( 982 Watch Count )   #Samsung\xe2\x80\xa6 https://t.co/M2sUaid5Hk',Samsung Galaxy plus Cracked Screen Glass Repair Replacement Mail Service Watch Count #Samsung,CustomerService,
9/22/2019 17:40,"b""Not impressed with @SamsungSA today I went to find out what's wrong the my #S9+ &amp; their Technician told me that\xe2\x80\xa6 https://t.co/L2MYxcy7jg""",impressed with today went find what wrong their Technician told that,Recommendation,
9/22/2019 17:30,b'A job at one of the largest R&amp;D centres in India is just a step away.  Interview with Samsung for a position at the\xe2\x80\xa6 https://t.co/vWterwrB15',largest centres India just step away Interview with Samsung position,News,
