created_at,text,tidy_tweet,Abstract,
9/24/2019 16:20,b'Install it RIGHT! Whitestone Dome Glass for Samsung Galaxy Note 10 Plus https://t.co/eRbdVR6SOQ via @YouTube\xe2\x80\xa6 https://t.co/WYjEO1vQgT',Install RIGHT Whitestone Dome Glass Samsung Galaxy Note Plus,CustomerService,
9/24/2019 16:18,"b'Samsung QN82Q80R 82"" Smart QLED 4K Ultra HD TV with HDR QN82Q80RAFXZA  ( Discount 37 % )   #Samsung  #QN82Q80R  https://t.co/MRX04gxGta'",Samsung Smart QLED Ultra with RAFXZA Discount #Samsung,Price,
9/24/2019 16:09,"b""Must have the world's slowest car charging cable. Like 2percent to 8percent in two hours. Go figure. #samsung""",Must have world slowest charging cable Like percent percent hours figure #samsung,Products,
9/24/2019 16:09,"b""Samsung Unveils 43.7MP Smartphone Sensor with the World's Smallest Pixels - PetaPixel \nhttps://t.co/rjUEHMQC14\xe2\x80\xa6 https://t.co/KNGUbySEne""",Samsung Unveils Smartphone Sensor with World Smallest Pixels PetaPixel nhttps rjUEHMQC,News,
9/24/2019 16:07,b'@SamsungSupport my fridge ice maker continues to freeze over. We purchased in 2016. What can we do? #help #fridge #samsung',fridge maker continues freeze over purchased What #help #fridge #samsung,Products,
9/24/2019 16:05,b'#Samsung Unveils 43.7MP Smartphone Sensor with the World\xe2\x80\x99s Smallest Pixels https://t.co/z4kx544dIL #news #technology',#Samsung Unveils Smartphone Sensor with World Smallest Pixels,News,
9/24/2019 16:02,"b'Samsung Galaxy S10, S10e, and S10+ smartphones on sale: Save up to $155 https://t.co/rV2CXrCx1V #MashableShopping #SamsungGalaxyS10 #Samsung'",Samsung Galaxy smartphones sale Save,Price,
9/24/2019 16:02,"b""iPhone XR is the UK's best-seller but #samsung is still Europe's.... #newestgadgets https://t.co/msybZqvDU0 https://t.co/5PlasnJhne""",iPhone best seller #samsung still Europe #newestgadgets,News,
9/24/2019 16:01,b'1/5 The #Galaxy #Fold is back and #Samsung addressed all the points I had highlighted after my first-round hands-on\xe2\x80\xa6 https://t.co/41KXCptUrz',#Galaxy #Fold back #Samsung addressed points highlighted after first round hands,News,
9/24/2019 16:01,"b'Samsung QN82Q80R 82"" Smart QLED 4K Ultra HD TV with HDR QN82Q80RAFXZA  ( Discount 37 % )   #Samsung  #QN82Q80R  https://t.co/A4rhUWjWs0'",Samsung Smart QLED Ultra with RAFXZA Discount #Samsung,Price,
9/24/2019 16:01,"b'#promo\xc3\xa7\xc3\xa3o #oferta  Smartphones Samsung Galaxy S9 / S9+ / S10e / S10 e mais  - R$ 1.709,10  #Samsung #Galaxy https://t.co/VTA21vUBD7'",#promo #oferta Smartphones Samsung Galaxy mais #Samsung #Galaxy,Price,
9/24/2019 16:01,b'Cooking Made Simple with Samsung\xe2\x80\x99s innovative Virtual Flame Technology.\xf0\x9f\x94\xa5\nWe are Proud to be in partnership with Sam\xe2\x80\xa6 https://t.co/11YsgAFUhv',Cooking Made Simple with Samsung innovative Virtual Flame Technology Proud partnership with,News,
9/24/2019 16:00,b'Galaxy Note 10 Plus BEST Tempered Glass Screen Protector WhiteStone Dome... https://t.co/sh039GWuCi via @YouTube\xe2\x80\xa6 https://t.co/yfh13kx2WQ',Galaxy Note Plus BEST Tempered Glass Screen Protector WhiteStone Dome,Products,
9/24/2019 16:00,b'SAMSUNG PATENTS DUAL-SCREEN SMARTPHONE\n\n#Samsung \n#DualScreen \n#patent https://t.co/pid5u2YMxQ',SAMSUNG PATENTS DUAL SCREEN SMARTPHONE n#Samsung n#DualScreen n#patent,Products,
9/24/2019 15:58,"b'#promo\xc3\xa7\xc3\xa3o #oferta  [AME por 1.013,99] Notebook Flash F30 Intel Celeron - R$ 1.351,99  #Samsung #notebook\xe2\x80\xa6 https://t.co/xakpqxtWWH'",#promo #oferta Notebook Flash Intel Celeron #Samsung #notebook,Price,
9/24/2019 15:55,"b'#promo\xc3\xa7\xc3\xa3o #oferta  Smartphone Samsung Galaxy S9+ 128GB Dual Chip 6GB RAM - R$ 2.179,15  #Samsung #Galaxy #smartphone https://t.co/kReLeIZ1nK'",#promo #oferta Smartphone Samsung Galaxy Dual Chip #Samsung #Galaxy #smartphone,Products,
9/24/2019 15:49,"b""@TechQuotesDaily Not true my tab s3 was slow like hell on TouchWiz Android Orio recently received One UI it's Much\xe2\x80\xa6 https://t.co/QGnBKJucdh""",true slow like hell TouchWiz Android Orio recently received Much,Products,
9/24/2019 15:47,"b'Uncovering a #DNA #methylation profile associated with resistance to #immunotherapy in #lungcancer and #melanoma, t\xe2\x80\xa6 https://t.co/Kq4CVbRGSm'",Uncovering #DNA #methylation profile associated with resistance #immunotherapy #lungcancer #melanoma,Products,
9/24/2019 15:46,"b'New #wallpaper ""Vortex"" Direct Message me to grab a copy #art #artistsoninstagram #abstractart #abstractpainting\xe2\x80\xa6 https://t.co/rqRpQAJCgX'",#wallpaper Vortex Direct Message grab copy #art #artistsoninstagram #abstractart #abstractpainting,Products,
9/24/2019 15:46,b'Check out USB Wall Charger Universal AC Power Adapter US Plug For iPhone Samsung #Samsung https://t.co/EC0IAy4km0 via @eBay',Check Wall Charger Universal Power Adapter Plug iPhone Samsung #Samsung,Products,
9/24/2019 15:46,b'Apple Series 4 GPS + Cellular scores 95.85 vs 91.17 by Samsung LTE Galaxy Watch 42mm - with eSIM on\xe2\x80\xa6 https://t.co/gQJfEU9LAq',Apple Series Cellular scores Samsung Galaxy Watch with eSIM,Products,
9/24/2019 15:44,"b'New #wallpaper ""Vortex"" Direct Message me to grab a copy #art #ArtistOnTwitter #abstractpainting #digitalpainting\xe2\x80\xa6 https://t.co/TeNuiX92Mf'",#wallpaper Vortex Direct Message grab copy #art #ArtistOnTwitter #abstractpainting #digitalpainting,Products,
9/24/2019 15:44,b'Broken Phone! Call us Now!\nWE BRING YOUR MOBILE SCREENS BACK TO LIFE\nWE FIX PHONES WHILE YOU WAIT\nSPS MOBILE\xe2\x80\xa6 https://t.co/jrL4KnGL7x',Broken Phone Call BRING YOUR MOBILE SCREENS BACK LIFE PHONES WHILE WAIT nSPS MOBILE,CustomerService,
9/24/2019 15:40,"b""@SamsungMobileME Hi @AppleSupport , is your support better than @SamsungMobileME , @SamsungMobile ? \n\nDidn't try ap\xe2\x80\xa6 https://t.co/OPS7YjkMDD""",your support better than nDidn,CustomerService,
9/24/2019 15:39,b'#electronics #smart #anime #tech #phone #fitness #hiking #camp #manga #iron #man #news #sports #charger #iphone\xe2\x80\xa6 https://t.co/4XOI5JkHgm',#electronics #smart #anime #tech #phone #fitness #hiking #camp #manga #iron #man #news #sports #charger #iphone,News,
9/24/2019 15:39,b'Got a chance to grab the all new #Samsung #Galaxy #M30s in the @amazonIN #GalaxyM30sQuiz \nFingers crossed',chance grab #Samsung #Galaxy #GalaxyM sQuiz nFingers crossed,Price,
9/24/2019 15:36,"b""Our most recent purchase was App Secrets by @seancasto of @Pre_Apps. Let us know what you're reading, listening to,\xe2\x80\xa6 https://t.co/RwfjH1i9yv""",most recent purchase Secrets know what reading listening,Price,
9/24/2019 15:32,"b'We don\xe2\x80\x99t just specialize in refurbished Apple products. \n\nWe have a great selection of #Samsung phones as well, lik\xe2\x80\xa6 https://t.co/gZAC1denxx'",just specialize refurbished Apple products have great selection #Samsung phones well,Recommendation,r
9/24/2019 15:31,b'6 tickets to the old Philippines please! \xf0\x9f\x87\xb5\xf0\x9f\x87\xad\n.\n.\n.\n.\n.\n.\n.\n.\n.\n.\n.\n.\n.\n.\n.\n.\n.\n.\n.\n.\n.\n.\n.\n.\n#phonephotography\xe2\x80\xa6 https://t.co/eMFRxe62H5',tickets Philippines please n#phonephotography,Products,
9/24/2019 15:31,"b'@SamsungIndia pathetic service experience of mobile by Samsung,  shame on such expensive devices claiming to be pre\xe2\x80\xa6 https://t.co/r3uWQpSpMX'",pathetic service experience mobile Samsung shame such expensive devices claiming,CustomerService,
9/24/2019 15:30,b'\xf0\x9f\x94\xa5The New Galaxy Note10 is almost here!\xf0\x9f\x94\xa5\nGet the Best Protection for your device\xf0\x9f\x92\x8e\n\nPRE-ORDER at 10% OFF starting on\xe2\x80\xa6 https://t.co/AWmNltzSqC',Galaxy Note almost here nGet Best Protection your device nPRE ORDER starting,News,
9/24/2019 15:30,"b'Samsung Galaxy Fold Believed to Launch in India on 1st October, Might Cost 1.75 Lakh\nhttps://t.co/cSwe4ssRba\n.\n.\n.\xe2\x80\xa6 https://t.co/QPnRAPEB7K'",Samsung Galaxy Fold Believed Launch India October Might Cost Lakh nhttps cSwe ssRba,Price,
9/24/2019 15:29,b'Samsung Patents Dual Screen Smartphone! The Left Side Is The Patent Design Whereas The Right Is Concept Of How It C\xe2\x80\xa6 https://t.co/GtktTJvemY',Samsung Patents Dual Screen Smartphone Left Side Patent Design Whereas Right Concept,Products,
9/24/2019 15:29,b'Samsung Galaxy Fold take two - TechCrunch \nhttps://t.co/njxOqqZGkp  #Samsung #Fold #Galaxy #tech https://t.co/wRX2yk9iMQ',Samsung Galaxy Fold take TechCrunch nhttps njxOqqZGkp #Samsung #Fold #Galaxy #tech,Recommendation,
9/24/2019 15:29,"b'Based on #Samsung\xe2\x80\x99s latest trolling campaign, it appears that #Huawei may be a bigger force than #Apple https://t.co/rAbeYsNs55'",Based #Samsung latest trolling campaign appears that #Huawei bigger force than #Apple,News,
9/24/2019 15:27,"b""We're hiring! Click to apply: Retail Sales-Samsung Electronics - https://t.co/gb7Czb9Nni #Samsung #SanFrancisco, CA""",hiring Click apply Retail Sales Samsung Electronics,Price,
9/24/2019 15:27,"b'(SAMSUNG Galaxy S10e - 128 GB, Prism White, White - S10e) - Now ONLY \xc2\xa3423.89 @BuySmartr - https://t.co/LkweN9SpwB\xe2\x80\xa6 https://t.co/DgxK06wzHP'",SAMSUNG Galaxy Prism White White ONLY,Products,
9/24/2019 15:26,b'Samsung\xe2\x80\x99s new camera sensor has the tiniest pixels ever - https://t.co/W99z6MzFIL #Samsung #smartphone',Samsung camera sensor tiniest pixels ever,Products,
9/24/2019 15:23,b'@SamsungMobileME @SamsungMobile @SamsungGulf #samsung i am not happy with the battery life of my note 9. Pls fix in\xe2\x80\xa6 https://t.co/sdLePvcBxa',#samsung happy with battery life note,Products,
9/24/2019 15:22,b'Uploaded a new video on YouTube  channel. #YouTube #Channel #technology #iOS13 #TechNews\n#samsung #samsungpakistan\xe2\x80\xa6 https://t.co/a6fy7Sq9sz',Uploaded video YouTube channel #YouTube #Channel #technology #iOS #TechNews n#samsung #samsungpakistan,News,
9/24/2019 15:21,"b'Great, huh?\n\n #iphone6 #samsung #iphone6plus #ios https://t.co/biC6L4dDKk'",Great #iphone #samsung #iphone plus #ios,Products,
9/24/2019 15:20,b'Just practicing those flicks \xf0\x9f\xa4\xad #fortnite #gameplay #fortnitegameplay #logitech #samsung #alienware #keyboard #mouse\xe2\x80\xa6 https://t.co/vhph4VyUt9',Just practicing those flicks #fortnite #gameplay #fortnitegameplay #logitech #samsung #alienware #keyboard #mouse,Recommendation,
9/24/2019 15:20,b'Why Wearables Are Important and What To Expect https://t.co/mm8OLsp2Gm #Wearables #Tech #Technology #hcldr #CIO\xe2\x80\xa6 https://t.co/8YUIAJw90Y',Wearables Important What Expect,Recommendation,
9/24/2019 15:19,b'I am really exicted for #GoMonster Samsung Galaxy M30s 6000 MmAh battery... Ya you heard ot right 6000 mAh battery\xf0\x9f\x94\x8b\xe2\x80\xa6 https://t.co/x1i7uNLfdD',really exicted #GoMonster Samsung Galaxy MmAh battery heard right battery,Recommendation,
9/24/2019 15:19,b'Samsung Galaxy Fold Will Be Launched In India On October 1! Price could be around Rs.1.5-1.7Lakh!\xe2\x80\xa6 https://t.co/wjFPZIhC72',Samsung Galaxy Fold Will Launched India October Price could around Lakh,Price,
9/24/2019 15:19,b'Not a bad 174 m snipe.. #fortnite #gaming #gameplay #goodquality #snipe #174m #logitech #samsung #alienware\xe2\x80\xa6 https://t.co/JeX0g4B02g',snipe #fortnite #gaming #gameplay #goodquality #snipe #logitech #samsung #alienware,Recommendation,
9/24/2019 15:19,b'Samsung Galaxy Note 10 Plus 5G Review - YouTube - https://t.co/eXsaB0Z4Br @Samsung #samsung #galaxy #note10',Samsung Galaxy Note Plus Review YouTube,Recommendation,
9/24/2019 15:18,b'Ebay #deal: for 144.97 USD (50% OFF) - Apple Watch Series 2 42mm Aluminum Case - Space Gray Silver Gold Rose Sport\xe2\x80\xa6 https://t.co/LVQWTI9VPy',Ebay #deal Apple Watch Series Aluminum Case Space Gray Silver Gold Rose Sport,Recommendation,
9/24/2019 15:17,b'Not a bad snipe \xf0\x9f\x92\xaf\xf0\x9f\xa4\x9f\xf0\x9f\x8f\xbc #fortnite #gaming #gamer #snipe #quickscope #gameplay #logitech #samsung #glorious\xe2\x80\xa6 https://t.co/OWuRqeEp8m',snipe #fortnite #gaming #gamer #snipe #quickscope #gameplay #logitech #samsung #glorious,Recommendation,
9/24/2019 15:15,b'Y\xe2\x80\x99all my dryer is broke AGAIN \xf0\x9f\x98\x94 ... same problem that was \xe2\x80\x9cfixed\xe2\x80\x9d 3 times under warranty - most recently about a mo\xe2\x80\xa6 https://t.co/FhWsa5L9F2',dryer broke AGAIN same problem that cfixed times under warranty most recently about,CustomerService,
9/24/2019 15:14,b'Samsung patents a smartphone with dual display design\n\n#Samsung #Galaxy #samsunggalaxy #Patents #GalaxyFold https://t.co/MsfU1bxV00',Samsung patents smartphone with dual display design n#Samsung #Galaxy #samsunggalaxy #Patents #GalaxyFold,Products,
9/24/2019 15:14,"b'After a five-month delay, the $2,000 Galaxy Fold arrives in the US on Friday \nhttps://t.co/XT2Wt9qs2J  #Fold\xe2\x80\xa6 https://t.co/ISpryu9guQ'",After five month delay Galaxy Fold arrives Friday nhttps #Fold,Products,
9/24/2019 15:09,b'#Wallpapers #homescreen  #Background #android #Samsung  #Google #walls #Free #iPhone11Pro #iPhone11\n\n** Not yet sha\xe2\x80\xa6 https://t.co/SddB0npX2X',#Wallpapers #homescreen #Background #android #Samsung #Google #walls #Free #iPhone #iPhone,Products,
9/24/2019 15:05,b'\xe2\x80\x9cIf you have a phone you can start a career.\xe2\x80\x9d Tiffany Rolfe from @RGA speaking to the insight that inspired the\xe2\x80\xa6 https://t.co/YUHQgmoz8u',have phone start career Tiffany Rolfe from speaking insight that inspired,News,
9/24/2019 15:04,b'My Note 10+ experiences frequent call drops and poor overall cell reception. Anyone else? #Samsung #Note10Plus #exynos',Note experiences frequent call drops poor overall cell reception Anyone else #Samsung #Note Plus #exynos,Products,
9/24/2019 15:04,b'Great example of the dynamic range produced by Galaxy Note10+\n\xe2\x97\x87\n#ShotOnGalaxy #Samsung #GalaxyNote10Plus\xe2\x80\xa6 https://t.co/N7eMzhZqPN',Great example dynamic range produced Galaxy Note n#ShotOnGalaxy #Samsung #GalaxyNote Plus,Products,
9/24/2019 15:01,b'#Samsung recently filed for a patent called #Programmable #Blockchain Solid State Drive and Switch. While not a lot\xe2\x80\xa6 https://t.co/XU9gO2QWFU',#Samsung recently filed patent called #Programmable #Blockchain Solid State Drive Switch While,News,
9/24/2019 15:00,b'#Wallpapers  #Background #android #Samsung  #Google #abstractart #Abstract #walls #Free #MacBook #MacBookPro #iMac\xe2\x80\xa6 https://t.co/kYvw7KymWC',#Wallpapers #Background #android #Samsung #Google #abstractart #Abstract #walls #Free #MacBook #MacBookPro #iMac,Products,
9/24/2019 14:59,b'Today these babies arrived by my mailbox \xf0\x9f\x98\xbc #samsung #s10e #zelda #finalfantasy #manga #switch #picoftheday https://t.co/qSmeYBn77l',Today these babies arrived mailbox #samsung #zelda #finalfantasy #manga #switch #picoftheday,News,
9/24/2019 14:59,b'#Wallpapers #homescreen #lockscreen #Background #android #Samsung  #abstractart #Abstract #gradient #Google #walls\xe2\x80\xa6 https://t.co/bYpNEYcAwm',#Wallpapers #homescreen #lockscreen #Background #android #Samsung #abstractart #Abstract #gradient #Google #walls,Products,
9/24/2019 14:59,b'#Wallpapers #homescreen #lockscreen #Background #android #Samsung  #abstractart #Abstract #gradient #Google #walls\xe2\x80\xa6 https://t.co/89B8kOMfZT',#Wallpapers #homescreen #lockscreen #Background #android #Samsung #abstractart #Abstract #gradient #Google #walls,Products,
9/24/2019 14:51,"b'I am a big fan of Samsung and I cannot believe why people still doubt this lit af phone. \xf0\x9f\x98\x82  cannot wait until 2025,\xe2\x80\xa6 https://t.co/mbvnULH4ZA'",Samsung cannot believe people still doubt this phone cannot wait until,News,
9/24/2019 14:50,b'Settings Design\nDesign for #dailyui #007 #appdesign #app #webdesign #uidesign #uxdesign #settings #design #samsung https://t.co/1ee8zat3fa',Settings Design nDesign #dailyui #appdesign #app #webdesign #uidesign #uxdesign #settings #design #samsung,Products,
9/24/2019 14:47,b'#Dubai: Oneplus 7 256gb 12gb ram - FREE ADS:\n\nhttps://t.co/0iT8gTOzC4 \n#dxb #mydubai #\xd8\xaf\xd8\xa8\xd9\x8a #\xd0\xb4\xd1\x83\xd0\xb1\xd0\xb0\xd0\xb9 #uae #sharjah\xe2\x80\xa6 https://t.co/dz1EZKsHmt',#Dubai Oneplus FREE nhttps gTOzC n#dxb #mydubai #uae #sharjah,Price,
9/24/2019 14:46,"b'#Samsung Galaxy Tab S6 review: master entertainer, amateur worker https://t.co/ViSUVbRqJt via @Verge'",#Samsung Galaxy review master entertainer amateur worker,Recommendation,
9/24/2019 14:45,"b'These products will be ranging from INR 6,699 to INR 26,999. \n#Samsung\n\nhttps://t.co/H8xevwpQVw'",These products will ranging from n#Samsung nhttps xevwpQVw,Products,
9/24/2019 14:45,b'The @SamsungCanada Galaxy Tab Active2 is built to stand up to the challenges the real world dishes out:\xe2\x80\xa6 https://t.co/4Fb5rAHUnf',Galaxy Active built stand challenges real world dishes,News,
9/24/2019 14:44,"b'@raywongy This is whats called a poor investment, well if you got money to play around then why not #samsung #fold'",This whats called poor investment well money play around then #samsung #fold,News,
9/24/2019 14:39,b'SAMSUNG unveils ISOCELL SLIM GH1 43.7MP SENSOR with 0.7\xce\xbcm SIZED PIXELS.\n\nThe smallest size Pixel Ever.\n\n#Samsung\xe2\x80\xa6 https://t.co/Adxwf68GQr',SAMSUNG unveils ISOCELL SLIM SENSOR with xbcm SIZED PIXELS nThe smallest size Pixel Ever n#Samsung,Products,
9/24/2019 14:37,"b'Clean UK Used Samsung Galaxy S7edge\n\n32gb N73,000\n\nDm/WhatsApp:08099728491\n\n#buylappie #lagos #uyo #abuja #ibadan\xe2\x80\xa6 https://t.co/zj1T84rSax'",Clean Used Samsung Galaxy edge WhatsApp n#buylappie #lagos #uyo #abuja #ibadan,Products,
9/24/2019 14:37,b'free for today (Sep 24): Broda Scrambler &amp; Badlands \xe2\x8c\x9a\xef\xb8\x8f\xf0\x9f\x91\x8d\nhttps://t.co/MEl5lXI9st\nhttps://t.co/AVlLs2EATx\n\n#Samsung\xe2\x80\xa6 https://t.co/BvAhCtOUOT',free today Broda Scrambler Badlands nhttps nhttps AVlLs EATx n#Samsung,Price,
9/24/2019 14:30,b'#AmazonSpinAndWin\n#GreatIndianSale\n#Amazon \n#AmazonGreatIndianFestival  \n#samsunggalaxy \n#GalaxyNote10Plus \n#Galaxy\xe2\x80\xa6 https://t.co/4Ij8VWg3ri',#AmazonSpinAndWin n#GreatIndianSale n#Amazon n#AmazonGreatIndianFestival n#samsunggalaxy n#GalaxyNote Plus n#Galaxy,Price,
9/24/2019 14:30,b'Best Galaxy Note 10 Deals https://t.co/J9zWep3sJ7\n#GalaxyNote10 #GalaxyNote10Plus  #SAMSUNG \n\nPROTECT YOUR VALUABLE\xe2\x80\xa6 https://t.co/9nmU3VdXHa',Best Galaxy Note Deals,Price,
9/24/2019 14:29,b'Using light and shadow to create this digital banner for the Note 10 Zizo Bolt case.\n.\n#banner #digitaldesign\xe2\x80\xa6 https://t.co/qRfWpxKFd5',Using light shadow create this digital banner Note Zizo Bolt case n#banner #digitaldesign,Products,
9/24/2019 14:29,b'@LewLater first tweet. Hi. You might want to look at the EE community site in the UK regarding fold orders. Barely\xe2\x80\xa6 https://t.co/4Mhfr8bftG',first tweet might want look community site regarding fold orders Barely,Price,
9/24/2019 14:27,"b""Just Wireless 4' Micro #USB #Cable - Gray\n\n \xf0\x9f\x94\x8c63% OFF     https://t.co/LNLq5m18ai\n\n#Target #Deal #Sale  #Compatible\xe2\x80\xa6 https://t.co/LDzACVN3FY""",Just Wireless Micro #USB #Cable Gray,Products,
9/24/2019 14:23,b'Why is #apple behind #samsung in #innovation ?',#apple behind #samsung #innovation,News,
9/24/2019 14:21,"b""Samsung Galaxy S10 series updated with Note10's Link to Windows feature and more #Samsung #GalaxyS10:\xe2\x80\xa6 https://t.co/Ph1qafnNUk""",Samsung Galaxy series updated with Note Link Windows feature more #Samsung #GalaxyS,Products,
9/24/2019 14:21,"b""Samsung announces the world's first 0.7\xce\xbcm-pixel mobile image sensor #Samsung #ISOCELL #SlimGH1: https://t.co/QWLqUYmlqn via @NeowinFeed""",Samsung announces world first xbcm pixel mobile image sensor #Samsung #ISOCELL #SlimGH,News,
9/24/2019 14:19,b'Samsung\xe2\x80\x99s Galaxy Fold could be heading to India on October 1 https://t.co/tFRLapaOlE \n#Samsung #galaxyfold',Samsung Galaxy Fold could heading India October,News,
9/24/2019 14:19,b'Samsung Galaxy S9\nBe the first to get a Samsung #Galaxy S9. Get a chance to win a new #Samsung #S9\n\n#canada\xe2\x80\xa6 https://t.co/f3g9yIPKrb',Samsung Galaxy first Samsung #Galaxy chance #Samsung n#canada,News,
9/24/2019 14:18,b'Like if you are Excited! Oh Yeah\n\n #iphone #samsung #gadget https://t.co/UJqozw1Nfl',Like Excited Yeah #iphone #samsung #gadget,Products,
9/24/2019 14:17,b'Thanks for the great review Grant!\n\n\xf0\x9f\x8c\x8ehttps://t.co/YiGgScBAjS\xf0\x9f\x8c\x8e\n\n\xf0\x9f\x8f\x8d\xf0\x9f\x92\xa8\n\n#motorcycles #navigation #Iphone #GPS #mapping\xe2\x80\xa6 https://t.co/rej7iff1sG',Thanks great review Grant ehttps YiGgScBAjS n#motorcycles #navigation #Iphone #GPS #mapping,Recommendation,
9/24/2019 14:10,b'Install it RIGHT! Whitestone Dome Glass for Samsung Galaxy Note 10 Plus https://t.co/eRbdVR6SOQ via @YouTube\xe2\x80\xa6 https://t.co/Bh8vp9mxvX',Install RIGHT Whitestone Dome Glass Samsung Galaxy Note Plus,Products,
9/24/2019 14:01,"b""The Galaxy Fold's screen should last 7 years ? we did the math. #samsung #tech https://t.co/XS1h2Wszto https://t.co/TxbQVYvb3o""",Galaxy Fold screen should last years math #samsung #tech,Products,
9/24/2019 13:52,"b'If there is an award in any part of the world, for the most descriptive and informative Tech youtuber, it will defi\xe2\x80\xa6 https://t.co/1mpg7k8JJA'",there award part world most descriptive informative Tech youtuber will defi,News,
9/24/2019 13:52,"b'Gitex is here! Snap up Free Gifts on #Samsung Galaxy S10 Plus features Triple Camera, 128GB with 8GB RAM, 4100mAh B\xe2\x80\xa6 https://t.co/HRXDhhJEc9'",Gitex here Snap Free Gifts #Samsung Galaxy Plus features Triple Camera with,Products,
9/24/2019 13:51,b'Future Proof FutureProofN Follow us for the latest news #samsung How to pick a 4K TV in 2019 https://t.co/aCnJZgeMKG',Future Proof FutureProofN Follow latest news #samsung pick,News,
9/24/2019 13:50,b'Galaxy Fold will be officially launched in the US market on September 27th and will only be available in AT&amp;T/Best\xe2\x80\xa6 https://t.co/GSQWfa6SPE',Galaxy Fold will officially launched market September will only available Best,News,
9/24/2019 13:47,b'#bestoftheday #instacool #socialenvyco #follow #colorful \n\n All-in-One Retractable and Tangle-Free Cable\n\nMore info\xe2\x80\xa6 https://t.co/rAhW56dZHb',#bestoftheday #instacool #socialenvyco #follow #colorful Retractable Tangle Free Cable nMore info,News,
9/24/2019 13:18,b'Your first #Samsung Galaxy Fold display replacement will cost... https://t.co/C5xcMQLKpF',Your first #Samsung Galaxy Fold display replacement will cost,Price,
9/24/2019 13:05,b'#news #samsung patents smartphone with dual display | Render https://t.co/4uAUzkr9I9',#news #samsung patents smartphone with dual display Render,News,
9/24/2019 13:00,"b'See our latest #Compton, CA job and click to apply: Retail Sales-Samsung Electronics - https://t.co/mXkyATeTNm #Samsung'",latest #Compton click apply Retail Sales Samsung Electronics,Price,
9/24/2019 12:59,"b""I'm not sure #Samsung \nSamsung's folding phone hits the US - ABC News - https://t.co/iCsptEYkJo via @ABC""",sure #Samsung nSamsung folding phone hits News,News,
9/24/2019 12:50,b'#Samsung #offer #replace\nSamsung will let Galaxy Fold owners replace their screens once for $149 https://t.co/oCjsYFzQQh via @Verge',#Samsung #offer #replace nSamsung will Galaxy Fold owners replace their screens once,Price,
9/24/2019 12:34,b'Samsung Galaxy S8+ plus Cracked Screen Glass Repair Replacement Mail In Service   ( 984 Watch count)   #Samsung\xe2\x80\xa6 https://t.co/a4QeG3g76k',Samsung Galaxy plus Cracked Screen Glass Repair Replacement Mail Service Watch count #Samsung,CustomerService,
9/24/2019 12:29,b'- Screen Widgets\n- Products Variety\n- Prices Variety\n- Customizable OS\n- User-friendly\n- Wireless Charging\n- Stylus\xe2\x80\xa6 https://t.co/zgIj3ULPeV',Screen Widgets Products Variety Prices Variety Customizable User friendly Wireless Charging Stylus,Price,
9/24/2019 12:26,b'Software Update Brings Powerful Galaxy Note10 Features to the Galaxy S10 #samsung #galaxy #GalaxyNote10 #GalaxyS10 https://t.co/peFQMjhM8y',Software Update Brings Powerful Galaxy Note Features Galaxy #samsung #galaxy #GalaxyNote #GalaxyS,Products,
9/24/2019 12:17,"b'#Samsung launches four new AKG headsets in India starting at Rs 6,699\nhttps://t.co/kl0ZIIbmr5'",#Samsung launches four headsets India starting nhttps ZIIbmr,News,
9/24/2019 12:16,b'Samsung Galaxy A Series\nCALL FOR PRICE\nMOQ APPLY\n*Ask for Availability**\n\n\xf0\x9f\x8c\x8e https://t.co/9gc1mYNAsR\xe2\x80\xa6 https://t.co/M9Z15hGjQ6',Samsung Galaxy Series nCALL PRICE nMOQ APPLY Availability,Price,
9/24/2019 11:59,b'Launch Events: Lighting Design Ideas from Samsung Unpacked #events #lighting #Samsung https://t.co/wnS7ECCTXA',Launch Events Lighting Design Ideas from Samsung Unpacked #events #lighting #Samsung,News,
9/24/2019 11:38,b'#Samsung Galaxy S11 May Feature Dual Displays According to Patent - https://t.co/khTb99yUdq\n \n#GalaxyS11 #GalaxyS11e https://t.co/XTEodT4KXm',#Samsung Galaxy Feature Dual Displays According Patent,Products,
9/24/2019 11:25,"b""Future Proof FutureProofN Follow us for the latest news #samsung Samsung's 43.7-megapixel sensor has the tiniest pi\xe2\x80\xa6 https://t.co/iqQ70e263u""",Future Proof FutureProofN Follow latest news #samsung Samsung megapixel sensor tiniest,News,
9/24/2019 11:25,"b""Future Proof FutureProofN Follow us for the latest news #samsung What do you want to know about Samsung's updated G\xe2\x80\xa6 https://t.co/QJkzEeaul7""",Future Proof FutureProofN Follow latest news #samsung What want know about Samsung updated,News,
9/24/2019 11:18,b'#samsungfold will launch on 1st October confirmed.....\n#samsung #s10plus \n@stufflistings',#samsungfold will launch October confirmed n#samsung plus,News,
