created_at,text,tidy_tweet,Abstract,
9/21/2019 3:56,"b'@blkagendareport @cynthiamckinney Empty brand loyalty euphoria, while #Apple sales sink in face of king #Samsung  a\xe2\x80\xa6 https://t.co/DXzTX92uNl'",Empty brand loyalty euphoria while #Apple sales sink face king #Samsung,Price,
9/21/2019 3:08,b'Samsung Galaxy S7 Edge Cracked Screen Glass Repair Replacement Mail In Service   ( 789 Watch Count )   #Samsung\xe2\x80\xa6 https://t.co/YaGeLI0l6A',Samsung Galaxy Edge Cracked Screen Glass Repair Replacement Mail Service Watch Count #Samsung,CustomerService,
9/21/2019 3:06,"b'#promo\xc3\xa7\xc3\xa3o #oferta  Notebook Samsung Odyssey Intel Core I7 8GB - R$ 3.884,06  #Samsung #notebook #led #informatica https://t.co/PMyvy2I6k4'",#promo #oferta Notebook Samsung Odyssey Intel Core #Samsung #notebook #led #informatica,News,
9/21/2019 0:34,"b'#promo\xc3\xa7\xc3\xa3o #oferta  Monitor LED 34"" Ultrawide Curvo Samsung LC34F791WQLXZD - R$ 2.879,99  #Samsung #led #informatica https://t.co/DJqicEApl5'",#promo #oferta Monitor Ultrawide Curvo Samsung WQLXZD #Samsung #led #informatica,News,
9/20/2019 23:47,b'#electronics #smart #anime #tech #phone #fitness #hiking #camp #manga #iron #man #news #sports #charger #iphone\xe2\x80\xa6 https://t.co/QFzkOFowDC',#electronics #smart #anime #tech #phone #fitness #hiking #camp #manga #iron #man #news #sports #charger #iphone,News,
9/20/2019 23:30,"b'We offer many services, but we specialize in device repair! FREE Diagnostics!\n\n#chicago  #chitown #igerschicago\xe2\x80\xa6 https://t.co/i5f58ZRVeq'",offer many services specialize device repair FREE Diagnostics n#chicago #chitown #igerschicago,Price,
9/20/2019 22:39,"b'#promo\xc3\xa7\xc3\xa3o #oferta  Notebook Samsung Intel Celeron N4000, 4GB 128GB - R$ 1.549,00  #Samsung #notebook #informatica https://t.co/dsQWDspiuD'",#promo #oferta Notebook Samsung Intel Celeron #Samsung #notebook #informatica,News,
9/20/2019 22:15,"b'\xf0\x9f\x8f\x9b\xef\xb8\x8f\xf0\x9f\x93\xb1 Samsung and the British Museum Offer 35,000 School Pupils the Chance to Virtually Visit the Museum:\xe2\x80\xa6 https://t.co/Y5NkzpW5Qg'",Samsung British Museum Offer School Pupils Chance Virtually Visit Museum,Price,
9/20/2019 21:48,"b""#promo\xc3\xa7\xc3\xa3o #oferta  Monitor Samsung Gamer Qled Curvo 23.5'' LC24FG73FQLXZD - R$ 1.175,99  #Samsung #informatica https://t.co/wmiM6OFQGw""",#promo #oferta Monitor Samsung Gamer Qled Curvo FQLXZD #Samsung #informatica,News,
9/20/2019 21:43,b'Compare prices on the (Samsung Galaxy Watch Active 40mm Black) @BuySmartr - https://t.co/n1vq1SHAB7 #Samsung\xe2\x80\xa6 https://t.co/bTOYglW9cO',Compare prices Samsung Galaxy Watch Active Black,Price,
9/20/2019 20:43,b'ah today is that Apple day\nwhen idiots line up infront of the stores for features that were available on android 3\xe2\x80\xa6 https://t.co/saobJnBYRu',today that Apple nwhen idiots line infront stores features that were available android,Products,
9/20/2019 20:40,b'Best quality best price! ! TEL : 02887729299 #photography #iphone #samsung #sony #nikon #canon #kodak #photographer\xe2\x80\xa6 https://t.co/3gtPx4U3OS',Best quality best price #photography #iphone #samsung #sony #nikon #canon #kodak #photographer,Price,
9/20/2019 20:20,b'#SAMSUNG Brings Innovative New Features And Blazing Performance To Its Latest SSDs https://t.co/6qja6sRAfq #Tweet4Mee',#SAMSUNG Brings Innovative Features Blazing Performance Latest SSDs,Products,
9/20/2019 20:07,"b'Dang, #iOS13 is out and still no search feature in the emojis \xf0\x9f\xa4\xa6\xf0\x9f\x8f\xbc\xe2\x80\x8d\xe2\x99\x80\xef\xb8\x8f found that pretty useful on my #Samsung \nStep it up @Apple'",Dang #iOS still search feature emojis found that pretty useful #Samsung nStep,Products,
9/20/2019 20:04,b'I am a fan of water features #yyj #reflection #reflections #addicted_to_reflections #water #fountain #worldshotz\xe2\x80\xa6 https://t.co/ozmD5g9BLe',water features #yyj #reflection #reflections #addicted reflections #water #fountain #worldshotz,Products,
9/20/2019 19:46,b'Samsung Galaxy S7 Edge Cracked Screen Glass Repair Replacement Mail In Service   ( 789 Watch Count )   #Samsung\xe2\x80\xa6 https://t.co/UlvwB84IsX',Samsung Galaxy Edge Cracked Screen Glass Repair Replacement Mail Service Watch Count #Samsung,CustomerService,
9/20/2019 19:42,b'@SamsungUS @SamsungSupport  very disappointed with your customer service.  Refrigerator stopped working on Sept. 5.\xe2\x80\xa6 https://t.co/AWriWYtnUk',very disappointed with your customer service Refrigerator stopped working Sept,CustomerService,
9/20/2019 19:21,b'#electronics #smart #anime #tech #phone #fitness #hiking #camp #manga #iron #man #news #sports #charger #iphone\xe2\x80\xa6 https://t.co/wdJXn94VYe',#electronics #smart #anime #tech #phone #fitness #hiking #camp #manga #iron #man #news #sports #charger #iphone,News,
9/20/2019 19:18,b'Visit Now.... #phonerepairs #Waterdamage Yes we fix them. We Repair #motherboard repairs #apple #iphone #Samsung\xe2\x80\xa6 https://t.co/gpNKu0AhPJ',Visit #phonerepairs #Waterdamage them Repair #motherboard repairs #apple #iphone #Samsung,CustomerService,
9/20/2019 18:45,"b'Samsung Galaxy S9 + to be available at half price in Flipkart Big Billion Days sale, read details.\nBUY THIS PHONE C\xe2\x80\xa6 https://t.co/Pxp5Mu5sPH'",Samsung Galaxy available half price Flipkart Billion Days sale read details nBUY THIS PHONE,Price,
9/20/2019 18:44,"b'Nervous to apply for a job like ""Retail Sales-Samsung Electronics"" at Samsung Electronics? Apply even if you\'re not\xe2\x80\xa6 https://t.co/lw98WDt1x6'",Nervous apply like Retail Sales Samsung Electronics Samsung Electronics Apply even,Price,
9/20/2019 18:18,"b""Samsung Galaxy A70s listed on company's website before launch, many features revealed.\n\nhttps://t.co/hQVi9LuNFa\xe2\x80\xa6 https://t.co/IwdBhwUWTi""",Samsung Galaxy listed company website before launch many features revealed nhttps hQVi LuNFa,Products,
9/20/2019 17:59,b'iPhone 6plus screen replacement \n#samsung #apple #repair #crackedscreen #microsoldering #cellphonerepair\xe2\x80\xa6 https://t.co/R3GiusLOUk',iPhone plus screen replacement n#samsung #apple #repair #crackedscreen #microsoldering #cellphonerepair,CustomerService,
9/20/2019 17:44,"b'@verge Samsung, taking customers money, and then being like:\n\n.      \xf0\x9f\x98\x8e\n          |\\\xf0\x9f\x91\x90\n         / \\\n\xe2\x94\x81\xe2\x94\x81\xe2\x94\x81\xe2\x94\x81\xe2\x94\x81\xe2\x94\x93 \xef\xbc\xbc\xef\xbc\xbc\n\xe2\x94\x93\xe2\x94\x93\xe2\x94\x93\xe2\x94\x93\xe2\x94\x93\xe2\x94\x83\xe2\x80\xa6 https://t.co/nwcTWH4dA1'",Samsung taking customers money then being like,CustomerService,
9/20/2019 17:41,b'Watch Samsung Galaxy A50s price in Philippines:\nhttps://t.co/u8E7pdfjW1\n\n#Samsung #Philippines #SamsungA50s @samsungph',Watch Samsung Galaxy price Philippines nhttps pdfjW n#Samsung #Philippines #SamsungA,Price,
9/20/2019 17:38,b'Watch here #Samsung Galaxy M30s price in #Nepal:\nhttps://t.co/NJIk6jYR7z\n\n#SamsungM30s @SamsungMobile',Watch here #Samsung Galaxy price #Nepal nhttps NJIk n#SamsungM,Price,
9/20/2019 17:37,b'Watch Samsung Galaxy M30s price in India:\nhttps://t.co/AxtlI0xRfK\n\n#Samsung #SamsungGalaxyM30s #India @SamsungIndia #SamsungM30s',Watch Samsung Galaxy price India nhttps AxtlI xRfK n#Samsung #SamsungGalaxyM #India #SamsungM,Price,
9/20/2019 17:26,b'Brand new. Unopened. 10% of the sale goes to @BCHLondon_ #breastaware #boobylicious #samsung https://t.co/TH6xUn0D5h',Brand Unopened sale goes #breastaware #boobylicious #samsung,Price,
9/20/2019 17:24,b'What if Samsung launched #GalaxyA30 in green colour \xf0\x9f\xa4\x94\n\n#GalaxyA #Samsung #SamsungGalaxy https://t.co/4kedIkkSEl',What Samsung launched #GalaxyA green colour n#GalaxyA #Samsung #SamsungGalaxy,News,
9/20/2019 17:23,"b'I have a few options to upgrade my phone- I can get an iphone 7 and 8, the samsung a20, a50 and a70 or the samsung\xe2\x80\xa6 https://t.co/Ft7Nl97Zro'",have options upgrade phone iphone samsung samsung,Products,
9/20/2019 16:08,b'Another Happy Customer unlocked a #Samsung #SM-G3815 on latest security patch #G3815XXUCOE1 with https://t.co/lr3qqBdw5r',Another Happy Customer unlocked #Samsung latest security patch XXUCOE with,CustomerService,
9/20/2019 15:40,b'@PriyaSundaram29 @pbatra7 @SamsungIndia @Pehredar U dont even bother about customer affairs..idiots\n\nU are asking\xe2\x80\xa6 https://t.co/xbQFiTtA6J',dont even bother about customer affairs idiots asking,CustomerService,
9/20/2019 15:12,b'My #wife has been on the #phone to @SamsungUSA for close to an hour trying to get a phone number for a #service cen\xe2\x80\xa6 https://t.co/W8RSUYDW67',#wife been #phone close hour trying phone number #service,CustomerService,
9/20/2019 15:11,b'I can now confirm that the Samsung Galaxy A70s will launch pretty soon in India. The product page for the device is\xe2\x80\xa6 https://t.co/BHHwU8NYGB',confirm that Samsung Galaxy will launch pretty soon India product page device,News,
9/20/2019 15:10,"b'Samsung #Galaxy Note 10+ Phone Review: Price, Camera, Performance, Display. #Samsung  Galaxy Note 10+ is a smartpho\xe2\x80\xa6 https://t.co/Eo8PlunUxU'",Samsung #Galaxy Note Phone Review Price Camera Performance Display #Samsung Galaxy Note smartpho,Price,
9/20/2019 15:09,b'I can now confirm that the Samsung Galaxy A70s will launch pretty soon in India. The product page for the device is\xe2\x80\xa6 https://t.co/J7LITbnSOe',confirm that Samsung Galaxy will launch pretty soon India product page device,News,
9/20/2019 15:06,"b""We're hiring! Click to apply: Retail Sales Associate - Samsung - https://t.co/8brZL1hbrR #Samsung #SanFrancisco, CA""",hiring Click apply Retail Sales Associate Samsung,Price,
9/20/2019 14:41,b'Samsung Galaxy S7 G930 Cracked Screen Glass Repair Replacement Mail In Service   ( 548 Watch count)   #Samsung\xe2\x80\xa6 https://t.co/UnUhoeB4oP',Samsung Galaxy Cracked Screen Glass Repair Replacement Mail Service Watch count #Samsung,CustomerService,
9/20/2019 14:40,b'Good news for Samsung fans :  #GalaxyA70s with #64MP Rear camera might launch in India by the end of September. Hop\xe2\x80\xa6 https://t.co/kPE4E1Q8KZ',Good news Samsung fans #GalaxyA with Rear camera might launch India September,News,
9/20/2019 14:40,b'\xe2\x9e\xa1 Samsung UHS-3 Class10 Micro SDXC Memory Card - Red 128G \n \xf0\x9f\x92\xb0 Price($): Only 18.09 \n \xf0\x9f\x94\x96 #Coupon: GBCNSXU3128GB \n \xe2\x9c\x85 L\xe2\x80\xa6 https://t.co/97D1O4cI7z',Samsung Class Micro SDXC Memory Card Price Only #Coupon GBCNSXU,Price,
9/20/2019 14:40,"b""We're hiring! Click to apply: Retail Sales-Samsung Electronics - https://t.co/Oi9AyCOiVv #Samsung #Emeryville, CA""",hiring Click apply Retail Sales Samsung Electronics,Price,
9/20/2019 14:28,b'Customer experience is the focus for @Samsung KX showcase https://t.co/1ykk1Iz7H1 #Samsung #CoalDropsYard #KX https://t.co/bTXwi3tTOT',Customer experience focus showcase,CustomerService,
9/20/2019 14:23,b'Samsung #GalaxyA70s with 64MP Rear camera might launch in India by the end of September\n\n#Samsung #GalaxyA\xe2\x80\xa6 https://t.co/K823TljU0t',Samsung #GalaxyA with Rear camera might launch India September n#Samsung #GalaxyA,News,
9/20/2019 14:12,"b""#promo\xc3\xa7\xc3\xa3o #oferta  Monitor Samsung Gamer Qled Curvo 23.5'' LC24FG73FQLXZD - R$ 1.275,99  #Samsung #informatica https://t.co/N9p4jjNVkV""",#promo #oferta Monitor Samsung Gamer Qled Curvo FQLXZD #Samsung #informatica,News,
9/20/2019 14:10,b'\xe2\x9e\xa1 Samsung Galaxy A80 4G Phablet 8GB RAM 128GB ROM Original International Version - Black 8+128G \n \xf0\x9f\x92\xb0 Price($): Only\xe2\x80\xa6 https://t.co/LmM2OniiR9',Samsung Galaxy Phablet Original International Version Black Price Only,Price,
9/20/2019 14:08,b'Samsung first smartphone with 64MP camera is set to launch this month.\n.\n.\nFollow @RishabhJaggi2 for more updates\n.\xe2\x80\xa6 https://t.co/cj0gjCqQzT',Samsung first smartphone with camera launch this month nFollow more updates,News,
9/20/2019 14:01,"b'Samsung Galaxy M10s With 6.4-inch Super AMOLED HD+ Display Dual Rear Cameras Launched: Price in India, Availability\xe2\x80\xa6 https://t.co/9AhUa1wg6p'",Samsung Galaxy With inch Super AMOLED Display Dual Rear Cameras Launched Price India Availability,Price,
9/20/2019 13:57,b'#movistar Day 47 of what originally was to be 7/10 days repair on a brand new #Samsung phone @SamsungMobile. Still\xe2\x80\xa6 https://t.co/GWMfWHnT3U',#movistar what originally days repair brand #Samsung phone Still,CustomerService,
9/20/2019 13:47,"b""What good is Huawei's Mate 30 pro, without Google service?\n\n@UniverseIce \n\n#Samsung \n#Note10Plus""",What good Huawei Mate without Google service n#Samsung n#Note Plus,CustomerService,
9/20/2019 13:36,"b'Just got my hands on @SamsungMobile new phone, the Samsung fold, truly brilliant price of tech and an absolute brea\xe2\x80\xa6 https://t.co/vfGfBg087X'",Just hands phone Samsung fold truly brilliant price tech absolute brea,Price,
9/20/2019 13:33,"b'See our latest #WestCovina, CA job and click to apply: Retail Sales Associate - Samsung - https://t.co/ZjGAgJ6oFp #Samsung'",latest #WestCovina click apply Retail Sales Associate Samsung,Price,
9/20/2019 13:15,b'#Apple\xe2\x80\x99s swipe feature for its keyboard doesn\xe2\x80\x99t include the space bar. #Samsung\xe2\x80\x99s did five years ago last time I us\xe2\x80\xa6 https://t.co/mSQVLMyXPS',#Apple swipe feature keyboard doesn include space #Samsung five years last time,Products,
9/20/2019 13:08,"b""Definitely doing an indepth review on this bad boy! This is a major upgrade, I'm still rocking an old gear fit 2 fr\xe2\x80\xa6 https://t.co/IVVGoLQymw""",Definitely doing indepth review this This major upgrade still rocking gear,Products,
9/20/2019 13:01,"b'Samsung Galaxy M30s With 6.4-inch FHD+ Display, 6000mAh battery, Triple Rear Camera: Price in India, Availability\xe2\x80\xa6 https://t.co/4fim6pAGd6'",Samsung Galaxy With inch Display battery Triple Rear Camera Price India Availability,Price,
9/20/2019 12:53,b'iPhone XS Screen replacement service!\nLog on to https://t.co/TTdZJpLB1c for more information.\nContact us -017-077-0\xe2\x80\xa6 https://t.co/9c46CNb8DC',iPhone Screen replacement service nLog,CustomerService,
9/20/2019 12:30,"b""The OnePlus 7T will offer 'the best charging solution for real-world usage'  #samsung... https://t.co/x3FTc9NLwZ https://t.co/W51ixkJUvX""",OnePlus will offer best charging solution real world usage #samsung,Price,
9/20/2019 12:09,b'#Samsung Mocks #Huawei Mate 30 Sans #Google #Apps And #Services https://t.co/p2lOhrZbwQ',#Samsung Mocks #Huawei Mate Sans #Google #Apps #Services,CustomerService,
9/20/2019 12:09,b'#Samsung really killed it with the launch of the #GalaxyM30s! Way to go Samsung!! I am already ruining getting a\xe2\x80\xa6 https://t.co/IFFlvvvtTK',#Samsung really killed with launch #GalaxyM Samsung already ruining getting,News,
9/20/2019 12:06,b'Samsung Galaxy A10s (SM-A107)\n***Last Model***\nCALL FOR PRICE\nMOQ APPLY\n\n\xf0\x9f\x8c\x8e https://t.co/9gc1mYNAsR\n\n#VentaAlMayor\xe2\x80\xa6 https://t.co/1EaS7MO0fr',Samsung Galaxy Last Model nCALL PRICE nMOQ APPLY,Price,
9/20/2019 11:42,b'Samsung Galaxy S7 Edge Cracked Screen Glass Repair Replacement Mail In Service   ( 789 Watch Count )   #Samsung\xe2\x80\xa6 https://t.co/j5B4Yha04K',Samsung Galaxy Edge Cracked Screen Glass Repair Replacement Mail Service Watch Count #Samsung,CustomerService,
9/20/2019 11:24,b'LIMITED DISCOUNT!!!\xf0\x9f\x98\x8dCheck out this Samsung S9 cover with 20% discount by introducing the code: 20OFFSEPSALE\n\nFind t\xe2\x80\xa6 https://t.co/ZfCoTVKEGb',LIMITED DISCOUNT dCheck this Samsung cover with discount introducing code OFFSEPSALE nFind,Price,
9/20/2019 10:45,"b'#SMB #entrepreneurs #TechnologyNews #CTO #CFO #CISO #friends #family #Samsung unveils new PCIe 4.0 #SSDs that ""neve\xe2\x80\xa6 https://t.co/eTIlDDMBwT'",#SMB #entrepreneurs #TechnologyNews #CTO #CFO #CISO #friends #family #Samsung unveils PCIe #SSDs that neve,News,
9/20/2019 10:41,b'@SamsungUS customer service from #Samsung THE WORST',customer service from #Samsung WORST,CustomerService,
9/20/2019 10:30,b'Phunware launching IEO for blockchain data exchange token on Liquid #blockchain #fiatmoney #convertiblebond\xe2\x80\xa6 https://t.co/TsfLkZAuRc',Phunware launching blockchain data exchange token Liquid #blockchain #fiatmoney #convertiblebond,News,
9/20/2019 10:02,"b'#Samsung is geared up to launch the #GalaxyA70s smartphone in India, later this month. The new smartphone is touted\xe2\x80\xa6 https://t.co/DTIE6ixNBD'",#Samsung geared launch #GalaxyA smartphone India later this month smartphone touted,News,
9/20/2019 10:00,"b'Samsung Nepal just launched the new Galaxy M30s for the price of Rs. 27,990 for 4/64GB variant and Rs. 33,590 for 6\xe2\x80\xa6 https://t.co/58espC7sLH'",Samsung Nepal just launched Galaxy price variant,Price,
9/20/2019 9:45,b'Samsung smartphones brings exclusive offers this Festive season. \n\n\xf0\x9f\x91\x89Call: Bapuji Nagar  9874798096 | Malancha 98300\xe2\x80\xa6 https://t.co/xJB2Pp0pcf',Samsung smartphones brings exclusive offers this Festive season Call Bapuji Nagar Malancha,Price,
9/20/2019 9:43,"b'#Samsung #GalaxyA70s Might Launch Soon, Indian Support Page Goes Live https://t.co/mzGeqhp1PJ https://t.co/s5wmAt80CW'",#Samsung #GalaxyA Might Launch Soon Indian Support Page Goes Live,News,
9/20/2019 9:42,"b""Give me 1, I'll have a family of #Samsung mobiles at home.\nThank you for the \xf0\x9f\x94\xa5\xf0\x9f\x94\xa5\xf0\x9f\x94\xa5 features in #SamsungM30s\xe2\x80\xa6 https://t.co/slC57SDncm""",Give have family #Samsung mobiles home nThank features #SamsungM,Products,
9/20/2019 9:09,"b'Vivo V17 Pro launched in India for \xe2\x82\xb929,990 to go on sale from 27th Sept on #Flipkart \n\nVs \n\nUpcoming Samsung Galaxy\xe2\x80\xa6 https://t.co/07lfHQKthP'",Vivo launched India sale from Sept #Flipkart nUpcoming Samsung Galaxy,Price,
9/20/2019 9:03,b'Loving my new #samsung s10 @EE are brilliant very good service really happy with them',Loving #samsung brilliant very good service really happy with them,CustomerService,
9/20/2019 9:02,b'The most trusted brand for reselling and buying new mobile phones!\nVISIT US:\n\n#shreeradhemobile #mobileservice\xe2\x80\xa6 https://t.co/kOTQUMvoSZ',most trusted brand reselling buying mobile phones nVISIT n#shreeradhemobile #mobileservice,CustomerService,
9/20/2019 8:16,"b'*Samsung Galaxy Note 10 (Aura Glow, 8GB RAM, 256GB Storage)*\nMRP - 75000\nOFFER PRICE - 69999\n\nORDER NOW -\xe2\x80\xa6 https://t.co/odMkD6jfy0'",Samsung Galaxy Note Aura Glow Storage nMRP nOFFER PRICE nORDER,Price,
9/20/2019 8:06,"b'Samsung Galaxy M30 (Gradation Black, 4+64 GB) \n\nhttps://t.co/iKhJfo6Gzf\n\nBest buy for the best price\nHurry Grab thi\xe2\x80\xa6 https://t.co/2S0YFVrcLX'",Samsung Galaxy Gradation Black nhttps iKhJfo nBest best price nHurry Grab,Price,
9/20/2019 8:01,b'Samsung Galaxy S7 Edge Cracked Screen Glass Repair Replacement Mail In Service   ( 789 Watch Count )   #Samsung\xe2\x80\xa6 https://t.co/AgstdI867k',Samsung Galaxy Edge Cracked Screen Glass Repair Replacement Mail Service Watch Count #Samsung,CustomerService,
9/20/2019 7:39,"b'Although ""factory reset protection"" is ment to be a security feature it is IMO one of the worst inventions in smart\xe2\x80\xa6 https://t.co/38I2s4MJzb'",Although factory reset protection ment security feature worst inventions smart,Products,
9/20/2019 7:37,b'Daily Gear VR News! https://t.co/F53SHpNKsT #samsung #dev',Daily Gear News,News,
9/20/2019 7:19,b'Make Your Phones Work As Efficiently As a New One\nCall Us : +91 9811313130\n#repair #service #laptoprepair\xe2\x80\xa6 https://t.co/vIfnhY83So',Make Your Phones Work Efficiently nCall n#repair #service #laptoprepair,CustomerService,
9/20/2019 7:12,b'#love #followback #Twitterers #socialenvy #tweegram \n\n New Air Vent Mount Car Phone Holder\n\nMore info ;\xe2\x80\xa6 https://t.co/oozdutfRIq',#love #followback #Twitterers #socialenvy #tweegram Vent Mount Phone Holder nMore info,News,
9/20/2019 7:00,b'Use our online booking calendar today and then check its process in our workshop with our online repair tracker\xe2\x80\xa6 https://t.co/uJvPL16WPg',online booking calendar today then check process workshop with online repair tracker,CustomerService,
9/20/2019 6:38,b'Samsung Galaxy S7 G930 Cracked Screen Glass Repair Replacement Mail In Service   ( 548 Watch Count )   #Samsung\xe2\x80\xa6 https://t.co/0VFPNRF1Vq',Samsung Galaxy Cracked Screen Glass Repair Replacement Mail Service Watch Count #Samsung,CustomerService,
9/20/2019 6:37,b'Samsung Launches New Galaxy M Series Smartphones @SamsungIndia \n\nhttps://t.co/0WYvstdcLP\n\nGalaxy M30s comes with a\xe2\x80\xa6 https://t.co/8ZZh8jFqnB',Samsung Launches Galaxy Series Smartphones nhttps WYvstdcLP nGalaxy comes with,Products,
9/20/2019 6:23,"b'Join 7 people right now at ""Samsung and Xiaomi Smartphones Available at Discounted Prices | Technobezz"" #cheers\xe2\x80\xa6 https://t.co/kHMUyOHkPH'",Join people right Samsung Xiaomi Smartphones Available Discounted Prices Technobezz #cheers,Price,
9/20/2019 6:19,b'*Samsung EB-P1100BPNGIN 10000mAH Lithium Ion Power Bank (Pink)*\nMRP - 1699\nOFFER PRICE - 1299\n\nORDER NOW -\xe2\x80\xa6 https://t.co/nBD0NW9x9b',Samsung BPNGIN Lithium Power Bank Pink nMRP nOFFER PRICE nORDER,Price,
9/20/2019 6:10,b'Enjoy Samsung Pay &amp; other awesome features with the #GalaxyA30S. Call 88280 99999 for details. Available at Easy EM\xe2\x80\xa6 https://t.co/l1Sjqypf3B',Enjoy Samsung other awesome features with #GalaxyA Call details Available Easy,Products,
9/20/2019 6:09,b'#Samsung #Microwave #SamsungMicrowave #HomeAppliances #MicrowaveOffers #PriceComparison #Bestdeals\xe2\x80\xa6 https://t.co/I7wpayrwHw',#Samsung #Microwave #SamsungMicrowave #HomeAppliances #MicrowaveOffers #PriceComparison #Bestdeals,Price,
9/20/2019 6:08,b'#Samsung #LEDTV #32inchTV #Televisions #SamsungTV #TVOffers #PriceComparison #Bestdeals #DiscountsGrabber\nSamsung 8\xe2\x80\xa6 https://t.co/tFf7lBR4di',#Samsung #LEDTV inchTV #Televisions #SamsungTV #TVOffers #PriceComparison #Bestdeals #DiscountsGrabber nSamsung,Price,
9/20/2019 5:27,b'Doorstep Computer Repair service in Golf Edge\n\nVintech Computers offers the repairs and services for #Computers and\xe2\x80\xa6 https://t.co/dmhM1hZV9O',Doorstep Computer Repair service Golf Edge nVintech Computers offers repairs services #Computers,CustomerService,
9/20/2019 5:08,b'#JustSmile #Healthy #Nyc #GOT #Pink \n\n Austin 10000mAh USB PowerBank Cylender\n\nMore info ; https://t.co/mwSf14G0Is\xe2\x80\xa6 https://t.co/KHY0ZWXNEh',#JustSmile #Healthy #Nyc #GOT #Pink Austin PowerBank Cylender nMore info,News,
9/20/2019 4:06,b'Samsung Galaxy S8 Cracked Screen Glass Repair Replacement Mail In Service   ( 665 Watch Count )   #Samsung  #Galaxy  https://t.co/nlpsrw6xgt',Samsung Galaxy Cracked Screen Glass Repair Replacement Mail Service Watch Count #Samsung #Galaxy,CustomerService,
9/20/2019 3:19,b'Going on now and ending Sunday night! Get your donations in for a shot at a Samsung tablet and help fund a service\xe2\x80\xa6 https://t.co/wz9kWh9dKN',Going ending Sunday night your donations shot Samsung tablet help fund service,CustomerService,
9/20/2019 3:12,"b""OneUI quite buggy on the @SamsungMobile Tab A 10.1 2019. \n1. App drawer doesn't feature all apps most of the time w\xe2\x80\xa6 https://t.co/D1IZrqrWNA""",OneUI quite buggy drawer doesn feature apps most time,Products,
9/20/2019 2:13,b'#electronics #smart #anime #tech #phone #fitness #hiking #camp #manga #iron #man #news #sports #charger #iphone\xe2\x80\xa6 https://t.co/4amuunbkxJ',#electronics #smart #anime #tech #phone #fitness #hiking #camp #manga #iron #man #news #sports #charger #iphone,News,
9/20/2019 1:32,b'Just received new #Samsung #Note10 ... Awesome device and #innovation #Features',Just received #Samsung #Note Awesome device #innovation #Features,Products,
9/20/2019 1:26,b'\xf0\x9f\x92\x8e Repairs \xf0\x9f\x9b\xa0\xef\xb8\x8fYour Loved\xe2\x9d\xa4\xef\xb8\x8fOne On The Spot\xe2\x9a\xa1\n\xe2\x9a\xa1 #need a #fast #time #onthespot #damage #phone #screen #repair in #Sydney\xe2\x80\xa6 https://t.co/IgaWpTzdnL',Repairs fYour Loved fOne Spot #need #fast #time #onthespot #damage #phone #screen #repair #Sydney,CustomerService,
9/20/2019 1:26,b'\xf0\x9f\x92\x8e Repairs \xf0\x9f\x9b\xa0\xef\xb8\x8fYour Loved\xe2\x9d\xa4\xef\xb8\x8fOne On The Spot\xe2\x9a\xa1\n\xe2\x9a\xa1 #need a #fast #time #onthespot #damage #phone #screen #repair in #Sydney\xe2\x80\xa6 https://t.co/SrLytmcP9U',Repairs fYour Loved fOne Spot #need #fast #time #onthespot #damage #phone #screen #repair #Sydney,CustomerService,
9/20/2019 1:20,b'#SAMSUNG Insider Delivers Galaxy S11 Bad News Blow https://t.co/RNf6DRvN2p #Tweet4Mee',#SAMSUNG Insider Delivers Galaxy News Blow,News,
9/20/2019 1:02,b'Samsung S9\n#Samsung #Galaxy #S9 Capture UHD Video. Super Low Light Camera. Dual Aperture Features. Fingerprint Secu\xe2\x80\xa6 https://t.co/Mh9Nq2vzqX',Samsung n#Samsung #Galaxy Capture Video Super Light Camera Dual Aperture Features Fingerprint Secu,Products,
9/20/2019 0:00,b'#Samsung: Keynote Speakers and Partnership Announcements to Take Center Stage at the Samsung Developer Conference https://t.co/CJaygyLA8l',#Samsung Keynote Speakers Partnership Announcements Take Center Stage Samsung Developer Conference,News,
9/19/2019 23:35,b'Bringing you the best of gadgets\n\n#gadgets #follow #repair #sales #tweet #dope #love #iphone #samsung #laptop\xe2\x80\xa6 https://t.co/Dmvmsox4fp',Bringing best gadgets n#gadgets #follow #repair #sales #tweet #dope #love #iphone #samsung #laptop,Price,
9/19/2019 21:10,b'#Samsung has launched new SSDs with fail-proof technology that will allow them to operate even if the NAND chips wi\xe2\x80\xa6 https://t.co/siNMVElCao',#Samsung launched SSDs with fail proof technology that will allow them operate even NAND chips,Products,
